<?xml version="1.0" encoding="utf-8" standalone="no" ?>
<!DOCTYPE dialog PUBLIC "-//paradise-office//DTD cygnet-dialog 0.1//EN" "http://www.linux-paradise.co.uk/DTDs/cygnet/dialogs.dtd">
  <dialog name="Breaks" type="modal">
    <field_box>
      <row num="1">
        <button name="Page" options="page" />
        <button name="Line" options="line" />
      </row>
      <row num="2">
        <button name="Landscape" options="landscape" />
        <button name="Column" options="column" />
      </row>
    </field_box>
    <button name="OK" command="ok" /><button name="Cancel" command="cancel" />
  </dialog>
